{
  "patch_id": "fixture-good-001",
  "agent_id": "cursor",
  "created_at": "2026-06-30T14:00:00Z",
  "target_repo": "ingestion-to-research-pipe",
  "base_ref": "task/deterministic-sync-pipeline",
  "operations": [
    {
      "op": "write",
      "path": "outbound_doorway/.fixture_good.md",
      "content_sha256": "faa5b4816800b8cbe1595e5533fe36c53f396c0c26a3a876dd3e4085232348a1",
      "content": "# fixture\n"
    }
  ]
}